{"binding_reference":{"content_hash":"sha256:e72dd177c4984b525782b0395c96cdc816907b1bf0731902acc729c1c49062bd","implementation_id":"schuss-implementation-000004","revision":1},"candidate_state":"candidate-under-test","canonical_profile":"schuss-canonical-json-v1","conformance_probe_id":"schuss-conformance-probe-000008","content_hash":"sha256:ea417068a0a1ff19c1faf11902b6262085432f6a9b6c8a62dc6b5e56c6c54f25","contract_reference":{"component_contract_id":"schuss-component-contract-000009","content_hash":"sha256:179c1526ed2bd6d9ad1c6fbfc9caa7abc21f479bef50cf93c8599b5817ca8718","revision":1},"environment_reference":{"content_hash":"sha256:8c2021ba5cbbcc1cbb63ca5957baeba71cdedf6a987d5f7091f609858539b3e7","prerequisite_environment_id":"schuss-prerequisite-environment-000001","revision":1},"execution_authorization":"task-011c-authorized","graph_reference":{"content_hash":"sha256:ea98b4cbf1ecb58d70338e5aaaef02385a6ede707b9b78bbc90fac09d53c7460","graph_id":"schuss-graph-000002","revision":1},"procedure_reference":{"content_hash":"sha256:86954dd767c3d49e396f25313f467d843b4d168d24e317e435fd61737c111985","procedure_id":"schuss-procedure-000002","revision":1},"production_selection_authority":false,"requested_stages":["backend-lowering","artifact-generation","target-compile-link"],"revision":2,"schema_version":"conformance-probe-input-v1"}
